{
  "allocation_ledger_sha256": "9f2dc4bf2b5a69ddd69940dd7ec77fb352733e0defedc8c1b74e6e2e570421d4",
  "cohort_id": "self-bootstrap-effectiveness-v2",
  "dispatch_allowed": false,
  "freeze_sha256": "d4244d161de5765e6aa79212e35fd04d90be1868c3151cbab20c7987a985a7de",
  "packet_count": 24,
  "packet_set_sha256": "913d143b628d681a1a959e2eae6d4c41a22f2bb61ff4eaa6ab280e9f07ab6422",
  "packets": [
    {
      "allocation_ledger_sha256": "9f2dc4bf2b5a69ddd69940dd7ec77fb352733e0defedc8c1b74e6e2e570421d4",
      "arm": "treatment",
      "arm_policy": {
        "content": "schema_version: 2\r\npolicy_id: structured-local-campaign-v2\r\ninstructions:\r\n  - Coordinate the assigned repository task through persisted dispatch envelopes and bounded native subagents.\r\n  - Use disjoint child write scopes, structured handoffs, dispatch audit, and an independent reviewer before integration.\r\n  - Preserve truthful evidence, failures, and limitations; do not message another cell or inspect excluded material.\r\ntools:\r\n  local_shell: allowed-within-write-scope\r\n  repository_read: allowed\r\n  native_subagents: {allowed: true, maximum_concurrent: 3, maximum_child_attempts: 4}\r\n  network: forbidden\r\nhandoff: audited structured handoffs plus one truthful integrated final task report\r\n",
        "path": "experiments/self-bootstrap-effectiveness-v2/templates/arm-treatment-v2.yaml",
        "sha256": "80b1d222e9804e7419c82001ed394a17c2d4c9175ba0100a9f9c341b0e2cb727"
      },
      "attempt_ordinal": 1,
      "baseline": {
        "git_commit": "722cceed959e8ac9c45cdfd519a4c387e614c58f",
        "git_tree": "f28c8500c7f4f5223234e87d1b0d2376fbb9539a"
      },
      "cell_id": "rp-03-review-record-binding::treatment",
      "cohort_id": "self-bootstrap-effectiveness-v2",
      "context_id": "ctx-01-9a5705e3",
      "dispatch_allowed": false,
      "execution_order": 1,
      "fixture_id": "rp-03-review-record-binding",
      "freeze_sha256": "d4244d161de5765e6aa79212e35fd04d90be1868c3151cbab20c7987a985a7de",
      "inputs": {
        "arm_policy_files": [
          {
            "sha256": "80b1d222e9804e7419c82001ed394a17c2d4c9175ba0100a9f9c341b0e2cb727",
            "source_path": "experiments/self-bootstrap-effectiveness-v2/templates/arm-treatment-v2.yaml"
          }
        ],
        "baseline_files": [
          {
            "sha256": "e93a106a431597b673631f3a57254816d1df5dd47f68d18c61a68838aba526d2",
            "source_path": "experiments/self-bootstrap-effectiveness-v2/templates/baseline-v2.yaml"
          }
        ],
        "fixture_files": [
          {
            "sha256": "e0da3011d9c7883e207a7b2ddc814ad82d1dadea053900766618eb52ad49fc94",
            "source_path": "experiments/self-bootstrap-effectiveness-v2/fixtures/rp-03-review-record-binding/prompt.txt"
          }
        ]
      },
      "packet_sha256": "e83aa0a06f427de4b4267f55fb2be562f9d2c93026cfcdb27130e2cc1d8c80e2",
      "replacement_policy": {
        "maximum_replacements": 0,
        "rule": "no-implicit-replacement-censor-cell"
      },
      "session_id": "s01-951b9571",
      "tools": {
        "local_shell": "allowed-within-write-scope",
        "native_subagents": {
          "allowed": true,
          "maximum_child_attempts": 4,
          "maximum_concurrent": 3
        },
        "network": "forbidden",
        "repository_read": "allowed"
      },
      "wave": 1,
      "workspace_contract": {
        "cwd": "experiments/self-bootstrap-effectiveness-v2/staging/attempts/s01-951b9571",
        "dedicated_worktree_required": true,
        "fork_context_required": "none",
        "host_enforcement": "host-observed-unsigned: worktree isolation and network disabled are declared, not attested",
        "network_required": false
      },
      "worktree_id": "wt-01-33d1ee63",
      "write_scope": [
        "science_repo/review.py",
        "tests/test_review_integration.py",
        "tests/test_record_resilience.py"
      ]
    },
    {
      "allocation_ledger_sha256": "9f2dc4bf2b5a69ddd69940dd7ec77fb352733e0defedc8c1b74e6e2e570421d4",
      "arm": "control",
      "arm_policy": {
        "content": "schema_version: 2\r\npolicy_id: solo-local-engineering-v2\r\ninstructions:\r\n  - Complete the assigned repository task as one fresh main agent.\r\n  - Work only in the packet write scope and preserve truthful evidence, failures, and limitations.\r\n  - Do not delegate, message another cell, inspect excluded registration material, or use prohibited resources.\r\ntools:\r\n  local_shell: allowed-within-write-scope\r\n  repository_read: allowed\r\n  native_subagents: forbidden\r\n  network: forbidden\r\nhandoff: one truthful final task report with commands, checks, changed paths, and unresolved items\r\n",
        "path": "experiments/self-bootstrap-effectiveness-v2/templates/arm-control-v2.yaml",
        "sha256": "5411901f38e9c8a86f2969179d9ea5d5899a5910904e30f951a213e89f0cafdf"
      },
      "attempt_ordinal": 1,
      "baseline": {
        "git_commit": "722cceed959e8ac9c45cdfd519a4c387e614c58f",
        "git_tree": "f28c8500c7f4f5223234e87d1b0d2376fbb9539a"
      },
      "cell_id": "or-03-coordinator-event-sequence::control",
      "cohort_id": "self-bootstrap-effectiveness-v2",
      "context_id": "ctx-02-5b1fe1a5",
      "dispatch_allowed": false,
      "execution_order": 2,
      "fixture_id": "or-03-coordinator-event-sequence",
      "freeze_sha256": "d4244d161de5765e6aa79212e35fd04d90be1868c3151cbab20c7987a985a7de",
      "inputs": {
        "arm_policy_files": [
          {
            "sha256": "5411901f38e9c8a86f2969179d9ea5d5899a5910904e30f951a213e89f0cafdf",
            "source_path": "experiments/self-bootstrap-effectiveness-v2/templates/arm-control-v2.yaml"
          }
        ],
        "baseline_files": [
          {
            "sha256": "e93a106a431597b673631f3a57254816d1df5dd47f68d18c61a68838aba526d2",
            "source_path": "experiments/self-bootstrap-effectiveness-v2/templates/baseline-v2.yaml"
          }
        ],
        "fixture_files": [
          {
            "sha256": "7f3af0254be039f1a4fd93f7abaaf6ff40dfc1d5296a50198e4cbb37adbe36a0",
            "source_path": "experiments/self-bootstrap-effectiveness-v2/fixtures/or-03-coordinator-event-sequence/prompt.txt"
          }
        ]
      },
      "packet_sha256": "3088c52c77f246d33ba429edad726d6516bba7cefde6b2dee7eafe8b455c62b3",
      "replacement_policy": {
        "maximum_replacements": 0,
        "rule": "no-implicit-replacement-censor-cell"
      },
      "session_id": "s02-5398e11e",
      "tools": {
        "local_shell": "allowed-within-write-scope",
        "native_subagents": "forbidden",
        "network": "forbidden",
        "repository_read": "allowed"
      },
      "wave": 1,
      "workspace_contract": {
        "cwd": "experiments/self-bootstrap-effectiveness-v2/staging/attempts/s02-5398e11e",
        "dedicated_worktree_required": true,
        "fork_context_required": "none",
        "host_enforcement": "host-observed-unsigned: worktree isolation and network disabled are declared, not attested",
        "network_required": false
      },
      "worktree_id": "wt-02-fede8988",
      "write_scope": [
        "science_repo/coordinator.py",
        "tests/test_coordinator.py",
        "tests/test_coordinator_hardening.py"
      ]
    },
    {
      "allocation_ledger_sha256": "9f2dc4bf2b5a69ddd69940dd7ec77fb352733e0defedc8c1b74e6e2e570421d4",
      "arm": "control",
      "arm_policy": {
        "content": "schema_version: 2\r\npolicy_id: solo-local-engineering-v2\r\ninstructions:\r\n  - Complete the assigned repository task as one fresh main agent.\r\n  - Work only in the packet write scope and preserve truthful evidence, failures, and limitations.\r\n  - Do not delegate, message another cell, inspect excluded registration material, or use prohibited resources.\r\ntools:\r\n  local_shell: allowed-within-write-scope\r\n  repository_read: allowed\r\n  native_subagents: forbidden\r\n  network: forbidden\r\nhandoff: one truthful final task report with commands, checks, changed paths, and unresolved items\r\n",
        "path": "experiments/self-bootstrap-effectiveness-v2/templates/arm-control-v2.yaml",
        "sha256": "5411901f38e9c8a86f2969179d9ea5d5899a5910904e30f951a213e89f0cafdf"
      },
      "attempt_ordinal": 1,
      "baseline": {
        "git_commit": "722cceed959e8ac9c45cdfd519a4c387e614c58f",
        "git_tree": "f28c8500c7f4f5223234e87d1b0d2376fbb9539a"
      },
      "cell_id": "dx-03-doctor-remediation::control",
      "cohort_id": "self-bootstrap-effectiveness-v2",
      "context_id": "ctx-03-86f89c05",
      "dispatch_allowed": false,
      "execution_order": 3,
      "fixture_id": "dx-03-doctor-remediation",
      "freeze_sha256": "d4244d161de5765e6aa79212e35fd04d90be1868c3151cbab20c7987a985a7de",
      "inputs": {
        "arm_policy_files": [
          {
            "sha256": "5411901f38e9c8a86f2969179d9ea5d5899a5910904e30f951a213e89f0cafdf",
            "source_path": "experiments/self-bootstrap-effectiveness-v2/templates/arm-control-v2.yaml"
          }
        ],
        "baseline_files": [
          {
            "sha256": "e93a106a431597b673631f3a57254816d1df5dd47f68d18c61a68838aba526d2",
            "source_path": "experiments/self-bootstrap-effectiveness-v2/templates/baseline-v2.yaml"
          }
        ],
        "fixture_files": [
          {
            "sha256": "ee105190b21f11e1a5f2b0aea2422359dc18c62dcf6545bdcdf04de94e2877e9",
            "source_path": "experiments/self-bootstrap-effectiveness-v2/fixtures/dx-03-doctor-remediation/prompt.txt"
          }
        ]
      },
      "packet_sha256": "c8ce0f6a945053c31157aabba7164785d1279748e4731b240dac3c5ca7c2eaf9",
      "replacement_policy": {
        "maximum_replacements": 0,
        "rule": "no-implicit-replacement-censor-cell"
      },
      "session_id": "s03-f067e9a0",
      "tools": {
        "local_shell": "allowed-within-write-scope",